{
  "date": "2026-10-25",
  "device": "windows-sera",
  "id": "2026-10-25-windows-keyword-mining-58163185-bd51-4b3a-9d54-6cd2795556a5",
  "kind": "research",
  "label": "150个游戏词发现与严格门槛筛查（中断，含待验证及未达标）",
  "market": {
    "country": "US",
    "language": "en"
  },
  "notes": [
    "用户要求Volume>3000、US Google Trends上涨、KD<=30、KGR<=0.25、SERP竞争合理；最优档Volume>10000、KD<20、KGR<0.2。",
    "KGR本轮沿用用户上文指定intitle精确短语页数/Volume公式；不以额外allintitle或旧数据代替。",
    "尚无完成全部门槛验收的词，不制造S/A/B推荐；所有150发现词按REJECT/PENDING研究状态完整入池。",
    "浏览器安全检查因无法可靠确认Windows当前URL中止浏览器，余下查询未完成。",
    "未直接调用付费API、未购买/部署/更改人工决定。"
  ],
  "schemaVersion": 1,
  "seeds": [
    "escape road 3",
    "orbit kick",
    "cowboy safari",
    "ragdoll playground",
    "slide down",
    "bucket smash",
    "mr flip",
    "rocket fortress",
    "city brawl",
    "rob brainrot 2",
    "italian brainrot clicker 2",
    "bat smash",
    "deer adventure",
    "glide in",
    "ragdoll flip",
    "undead corridor",
    "escape road city 2",
    "jetski race",
    "golf hit",
    "head basketball",
    "escape road 2",
    "chill guy clicker",
    "slope 3",
    "traffic rally",
    "drift rush",
    "airborne bmx",
    "animal craft",
    "dude theft auto",
    "bike xtreme",
    "tap road 2",
    "speed stars",
    "level devil",
    "monkey mart",
    "slice master",
    "retro bowl",
    "blocky blast puzzle",
    "cryzen io",
    "super liquid soccer",
    "blumgi slime",
    "blumgi bounce",
    "plonky",
    "under the red sky",
    "rocket soccer derby",
    "blacktop police chase",
    "vectaria io",
    "minefun io",
    "ragdoll bonk",
    "slime keyboard escape",
    "soccer skills 2 world cup",
    "soccer skills champions league",
    "watermelon drop",
    "exhibit of sorrows",
    "stick rush",
    "spacebar clicker",
    "iron snout",
    "gladihoppers",
    "rowdy city wrestling",
    "war of sticks",
    "big shot boxing",
    "super star car",
    "openfront",
    "veck io",
    "frontwars io",
    "racing limits",
    "miniblox",
    "war the knights",
    "blombo io",
    "hexanaut io",
    "meeland io",
    "unmatched ego 2",
    "the machinegg",
    "bloxd io",
    "kour io",
    "growden io",
    "waffle game",
    "semantle",
    "phoodle",
    "duotrigordle",
    "framed game",
    "letroso",
    "sedecordle",
    "dordle",
    "tradle",
    "feudle",
    "unlockle",
    "polygonle",
    "quintessential game",
    "actorle",
    "octordle",
    "countryle",
    "subwaydle",
    "word peaks",
    "symble",
    "crosshare",
    "cell tower game",
    "word500",
    "word waffle",
    "reheardle",
    "flickle",
    "movie pyramid",
    "catdoku",
    "unbox the room",
    "ant flow",
    "donut clicker",
    "capybara mart",
    "hill sprint",
    "planet merge",
    "basketball hit",
    "tiny garden war",
    "park empire",
    "blockader",
    "wave race",
    "crashy rush",
    "flip spot",
    "flip or fail",
    "stickman coin flip",
    "endless jump",
    "bat smash 2",
    "ragdoll sandbox",
    "shape rush",
    "tnt sandbox",
    "my perfect hotel",
    "longcat",
    "murder game",
    "crazy cars",
    "anycolor",
    "dino simulator",
    "ragdoll drop",
    "soccer real",
    "bugs io",
    "backroom bill",
    "pilot life",
    "supercars city",
    "brainrot miner",
    "hide and paint",
    "monkey tag io",
    "tear blocks down",
    "karate fighter",
    "kawaii fruits 3d",
    "count control legends",
    "supercar legends",
    "prankster 3d",
    "ghost rush",
    "mountain climb stunt",
    "find the needle in haystack",
    "pro referee simulator",
    "hatch your pets",
    "ragdoll chaos",
    "blockpost 2.0",
    "nsr street car racing"
  ],
  "sources": [
    {
      "note": "来源、明确门槛、覆盖、分级与中断原因",
      "path": "research/2026-10-25-windows-keyword-mining-58163185-bd51-4b3a-9d54-6cd2795556a5/README.md"
    },
    {
      "note": "逐词实际结果、待补及未达标原因",
      "path": "research/2026-10-25-windows-keyword-mining-58163185-bd51-4b3a-9d54-6cd2795556a5/results.json"
    }
  ],
  "status": "partial"
}
